{
  "decision_ref": "DEC-001",
  "pause_id": "fbab28345cd345a8a18736315992f0ff",
  "reason": "REVIEW_USER_DECISION_REQUIRED",
  "ticket_id": "T-010",
  "pipeline_stage": "IMPLEMENTATION",
  "options": [
    "FIX_REQUIRED"
  ],
  "resolved": true,
  "chosen_option": "FIX_REQUIRED",
  "rationale": "User provided iPhone; host joined tailnet; proceed with T-010 remote acceptance evidence",
  "source": "tailscale status: Running, DNSName alvin.tail63d20f.ts.net, IP 100.119.224.46; iPhone iphone-15-plus present in tailnet",
  "context": null
}